{
  "base": 0.0,
  "id": "skills:knockback_resistance",
  "levels": {
    "modifiers": [
      {
        "attribute": "minecraft:knockback_resistance",
        "id": "skills:upgrade/knockback_resistance",
        "operation": "add_value",
        "value": 0.02
      }
    ],
    "xp": 50
  },
  "icon": "skills:skill/knockback_resistance",
  "max_level": 50
}