{
  "base": 4.5,
  "id": "skills:block_interaction_range",
  "levels": {
    "modifiers": [
      {
        "attribute": "minecraft:block_interaction_range",
        "id": "skills:upgrade/block_interaction_range",
        "operation": "add_value",
        "value": 0.1
      }
    ],
    "xp": 25
  },
  "icon": "skills:skill/block_interaction",
  "max_level": 50
}