{
  "base": 0.7,
  "id": "skills:movement_speed",
  "levels": {
    "modifiers": [
      {
        "attribute": "minecraft:movement_speed",
        "id": "skills:upgrade/movement_speed",
        "operation": "add_multiplied_base",
        "value": 0.015
      }
    ],
    "xp": 20
  },
  "icon": "minecraft:mob_effect/speed",
  "max_level": 100
}