{
  "base": 1.0,
  "id": "skills:reduce_burning_time",
  "levels": {
    "modifiers": [
      {
        "attribute": "minecraft:burning_time",
        "id": "skills:upgrade/reduce_burning_time",
        "operation": "add_value",
        "value": -0.01
      }
    ],
    "xp": 20
  },
  "icon": "minecraft:mob_effect/fire_resistance",
  "max_level": 90
}