{
  "base": 0.0,
  "id": "skills:explosion_knockback_resistance",
  "levels": {
    "modifiers": [
      {
        "attribute": "minecraft:explosion_knockback_resistance",
        "id": "skills:upgrade/explosion_knockback_resistance",
        "operation": "add_value",
        "value": 0.01
      }
    ],
    "xp": 20
  },
  "icon": "skills:skill/explosion_knockback_resistance",
  "max_level": 50
}