{
  "base": 0.0,
  "id": "skills:attack_knockback",
  "levels": {
    "modifiers": [
      {
        "attribute": "minecraft:attack_knockback",
        "id": "skills:upgrade/attack_knockback",
        "operation": "add_value",
        "value": 0.1
      }
    ],
    "xp": 25
  },
  "icon": "skills:skill/attack_knockback",
  "max_level": 50
}