{
  "base": 4.0,
  "id": "skills:attack_speed",
  "levels": {
    "modifiers": [
      {
        "attribute": "minecraft:attack_speed",
        "id": "skills:upgrade/attack_speed",
        "operation": "add_multiplied_base",
        "value": 0.1
      }
    ],
    "xp": 40
  },
  "icon": "skills:skill/attack_speed",
  "max_level": 40
}