{
  "base": 20.0,
  "id": "skills:max_health",
  "levels": {
    "modifiers": [
      {
        "attribute": "minecraft:max_health",
        "id": "skills:upgrade/max_health",
        "operation": "add_value",
        "value": 1.0
      }
    ],
    "xp": 25
  },
  "icon": "minecraft:mob_effect/health_boost",
  "max_level": 40
}