{
  "base": 0.41999998688697815,
  "id": "skills:jump_strength",
  "levels": {
    "modifiers": [
      {
        "attribute": "minecraft:jump_strength",
        "id": "skills:upgrade/jump_strength",
        "operation": "add_multiplied_base",
        "value": 0.005
      }
    ],
    "xp": 10
  },
  "icon": "minecraft:mob_effect/jump_boost",
  "max_level": 100
}