{
  "base": 0.0,
  "id": "skills:luck",
  "levels": {
    "modifiers": [
      {
        "attribute": "minecraft:luck",
        "id": "skills:upgrade/luck",
        "operation": "add_value",
        "value": 1.0
      }
    ],
    "xp": 20
  },
  "icon": "minecraft:mob_effect/luck",
  "max_level": 100
}