{
  "base": 0.0,
  "id": "skills:oxygen_bonus",
  "levels": {
    "modifiers": [
      {
        "attribute": "minecraft:oxygen_bonus",
        "id": "skills:upgrade/oxygen_bonus",
        "operation": "add_value",
        "value": 1
      }
    ],
    "xp": 10
  },
  "icon": "minecraft:mob_effect/water_breathing",
  "max_level": 33
}