{
  "base": 3.0,
  "id": "skills:entity_interaction_range",
  "levels": {
    "modifiers": [
      {
        "attribute": "minecraft:entity_interaction_range",
        "id": "skills:upgrade/entity_interaction_range",
        "operation": "add_value",
        "value": 0.1
      }
    ],
    "xp": 25
  },
  "icon": "skills:skill/entity_interaction",
  "max_level": 45
}