{
  "base": 3.0,
  "id": "skills:safe_fall_distance",
  "levels": {
    "modifiers": [
      {
        "attribute": "minecraft:safe_fall_distance",
        "id": "skills:upgrade/safe_fall_distance",
        "operation": "add_value",
        "value": 0.1
      }
    ],
    "xp": 40
  },
  "icon": "minecraft:mob_effect/levitation",
  "max_level": 50
}